No,;Time;Source;Destination;Protocol;Length;Info;;;Time1;Time2;Delay;;Delay1;Delay2;Jitter
1;0;192,168,1,6;36,92,238,205;TCP;66;57999  >  80 [SYN] Seq=0 Win=64240 Len=0 MSS=1460 WS=256 SACK_PERM=1;;;0;1,011917;2,014201;;1,983463;0,030738;-1,952725
2;1,011917;192,168,1,6;36,92,238,205;TCP;66;[TCP Retransmission] 57999  >  80 [SYN] Seq=0 Win=64240 Len=0 MSS=1460 WS=256 SACK_PERM=1;;;1,011917;3,026118;0,030738;;-2,347633;2,378371;4,726004
3;3,026118;192,168,1,6;36,92,238,205;TCP;66;[TCP Retransmission] 57999  >  80 [SYN] Seq=0 Win=64240 Len=0 MSS=1460 WS=256 SACK_PERM=1;;;3,026118;3,056856;2,378371;;2,378371;0;-2,378371
4;3,056856;204,79,197,254;192,168,1,6;TCP;54;443  >  57943 [RST, ACK] Seq=1 Ack=1 Win=0 Len=0;;;3,056856;5,435227;0;;-0,000149;0,000149;0,000298
5;5,435227;117,18,237,29;192,168,1,6;TCP;56;80  >  57944 [ACK] Seq=1 Ack=1 Win=131 Len=0;;;5,435227;5,435227;0,000149;;-0,000108;0,000257;0,000365
6;5,435227;117,18,237,29;192,168,1,6;TCP;54;[TCP Previous segment not captured] 80  >  57944 [FIN, ACK] Seq=2 Ack=1 Win=131 Len=0;;;5,435227;5,435376;0,000257;;-0,0068;0,007057;0,013857
7;5,435376;192,168,1,6;117,18,237,29;TCP;54;[TCP ACKed unseen segment] 57944  >  80 [ACK] Seq=1 Ack=2 Win=516 Len=0;;;5,435376;5,435633;0,007057;;0,006961;0,000096;-0,006865
8;5,435633;192,168,1,6;117,18,237,29;TCP;54;57944  >  80 [ACK] Seq=1 Ack=3 Win=516 Len=0;;;5,435633;5,44269;0,000096;;-0,019391;0,019487;0,038878
9;5,44269;117,18,237,29;192,168,1,6;TCP;54;[TCP Retransmission] 80  >  57944 [FIN, ACK] Seq=2 Ack=1 Win=131 Len=0;;;5,44269;5,442786;0,019487;;0,012074;0,007413;-0,004661
10;5,442786;192,168,1,6;117,18,237,29;TCP;54;[TCP Dup ACK 8#1] 57944  >  80 [ACK] Seq=1 Ack=3 Win=516 Len=0;;;5,442786;5,462273;0,007413;;-1,551055;1,558468;3,109523
11;5,462273;192,168,1,6;5,62,54,89;TCP;55;57849  >  80 [ACK] Seq=1 Ack=1 Win=64240 Len=1;;;5,462273;5,469686;1,558468;;-3,984829;5,543297;9,528126
12;5,469686;5,62,54,89;192,168,1,6;TCP;56;80  >  57849 [ACK] Seq=1 Ack=2 Win=4400 Len=0;;;5,469686;7,028154;5,543297;;5,514852;0,028445;-5,486407
13;7,028154;192,168,1,6;36,92,238,205;TCP;66;[TCP Retransmission] 57999  >  80 [SYN] Seq=0 Win=64240 Len=0 MSS=1460 WS=256 SACK_PERM=1;;;7,028154;12,571451;0,028445;;0,009934;0,018511;0,008577
16;12,571451;117,18,237,29;192,168,1,6;TCP;54;80  >  57944 [RST, ACK] Seq=3 Ack=1 Win=0 Len=0;;;12,571451;12,599896;0,018511;;0,018321;0,00019;-0,018131
17;12,599896;192,168,1,6;117,18,237,29;TCP;54;57985  >  80 [FIN, ACK] Seq=1 Ack=1 Win=513 Len=0;;;12,599896;12,618407;0,00019;;-1,53129;1,53148;3,06277
18;12,618407;117,18,237,29;192,168,1,6;TCP;54;80  >  57985 [FIN, ACK] Seq=1 Ack=2 Win=288 Len=0;;;12,618407;12,618597;1,53148;;1,514916;0,016564;-1,498352
19;12,618597;192,168,1,6;117,18,237,29;TCP;54;57985  >  80 [ACK] Seq=2 Ack=2 Win=513 Len=0;;;12,618597;14,150077;0,016564;;-0,223136;0,2397;0,462836
22;14,150077;192,168,1,6;104,20,1,94;TCP;66;58000  >  443 [SYN] Seq=0 Win=64240 Len=0 MSS=1460 WS=256 SACK_PERM=1;;;14,150077;14,166641;0,2397;;0,183358;0,056342;-0,127016
26;14,166641;125,162,96,1;192,168,1,6;ICMP;94;Destination unreachable (Communication administratively filtered);;;14,166641;14,406341;0,056342;;0,056067;0,000275;-0,055792
28;14,406341;192,168,1,6;104,20,1,94;TCP;66;58001  >  443 [SYN] Seq=0 Win=64240 Len=0 MSS=1460 WS=256 SACK_PERM=1;;;14,406341;14,462683;0,000275;;-0,002052;0,002327;0,004379
29;14,462683;104,20,1,94;192,168,1,6;TCP;66;443  >  58001 [SYN, ACK] Seq=0 Ack=1 Win=65535 Len=0 MSS=1400 SACK_PERM=1 WS=1024;;;14,462683;14,462958;0,002327;;-0,055825;0,058152;0,113977
30;14,462958;192,168,1,6;104,20,1,94;TCP;54;58001  >  443 [ACK] Seq=1 Ack=1 Win=131584 Len=0;;;14,462958;14,465285;0,058152;;0,012336;0,045816;0,03348
31;14,465285;192,168,1,6;104,20,1,94;TLSv1,3;602;Client Hello;;;14,465285;14,523437;0,045816;;0,021812;0,024004;0,002192
32;14,523437;104,20,1,94;192,168,1,6;TLSv1,3;266;Server Hello, Change Cipher Spec, Application Data;;;14,523437;14,569253;0,024004;;0,023155;0,000849;-0,022306
33;14,569253;192,168,1,6;104,20,1,94;TCP;54;58001  >  443 [ACK] Seq=549 Ack=213 Win=131328 Len=0;;;14,569253;14,593257;0,000849;;-0,001275;0,002124;0,003399
35;14,593257;192,168,1,6;104,20,1,94;TLSv1,3;118;Change Cipher Spec, Application Data;;;14,593257;14,594106;0,002124;;-0,052197;0,054321;0,106518
36;14,594106;192,168,1,6;104,20,1,94;TLSv1,3;146;Application Data;;;14,594106;14,59623;0,054321;;0,051198;0,003123;-0,048075
37;14,59623;192,168,1,6;104,20,1,94;TLSv1,3;1025;Application Data;;;14,59623;14,650551;0,003123;;0,002934;0,000189;-0,002745
38;14,650551;104,20,1,94;192,168,1,6;TCP;56;443  >  58001 [ACK] Seq=213 Ack=613 Win=67584 Len=0;;;14,650551;14,653674;0,000189;;-0,04317;0,043359;0,086529
39;14,653674;104,20,1,94;192,168,1,6;TLSv1,3;85;[TCP Previous segment not captured] , Application Data;;;14,653674;14,653863;0,043359;;-0,207265;0,250624;0,457889
40;14,653863;192,168,1,6;104,20,1,94;TCP;66;[TCP Dup ACK 33#1] 58001  >  443 [ACK] Seq=1676 Ack=213 Win=131328 Len=0 SLE=725 SRE=756;;;14,653863;14,697222;0,250624;;0,250502;0,000122;-0,25038
41;14,697222;104,20,1,94;192,168,1,6;TCP;56;443  >  58001 [ACK] Seq=756 Ack=1676 Win=69632 Len=0;;;14,697222;14,947846;0,000122;;-0,000516;0,000638;0,001154
42;14,947846;104,20,1,94;192,168,1,6;TLSv1,3;1445;Application Data;;;14,947846;14,947968;0,000638;;0,000638;0;-0,000638
43;14,947968;192,168,1,6;104,20,1,94;TCP;66;[TCP Dup ACK 33#2] 58001  >  443 [ACK] Seq=1676 Ack=213 Win=131328 Len=0 SLE=725 SRE=2147;;;14,947968;14,948606;0;;0;0;0
44;14,948606;104,20,1,94;192,168,1,6;TLSv1,3;1506;Application Data;;;14,948606;14,948606;0;;0;0;0
45;14,948606;104,20,1,94;192,168,1,6;TLSv1,3;1384;[TCP Previous segment not captured] , Continuation Data;;;14,948606;14,948606;0;;-0,000128;0,000128;0,000256
46;14,948606;104,20,1,94;192,168,1,6;TLSv1,3;1445;Application Data;;;14,948606;14,948606;0,000128;;-0,000017;0,000145;0,000162
47;14,948606;104,20,1,94;192,168,1,6;TLSv1,3;120;Application Data, Application Data;;;14,948606;14,948734;0,000145;;0,00006;0,000085;0,000025
48;14,948734;192,168,1,6;104,20,1,94;TCP;66;[TCP Dup ACK 33#3] 58001  >  443 [ACK] Seq=1676 Ack=213 Win=131328 Len=0 SLE=725 SRE=3599;;;14,948734;14,948879;0,000085;;-0,000029;0,000114;0,000143
49;14,948879;192,168,1,6;104,20,1,94;TCP;74;[TCP Dup ACK 33#4] 58001  >  443 [ACK] Seq=1676 Ack=213 Win=131328 Len=0 SLE=9163 SRE=10493 SLE=725 SRE=3599;;;14,948879;14,948964;0,000114;;-0,057146;0,05726;0,114406
50;14,948964;192,168,1,6;104,20,1,94;TCP;74;[TCP Dup ACK 33#5] 58001  >  443 [ACK] Seq=1676 Ack=213 Win=131328 Len=0 SLE=9163 SRE=11884 SLE=725 SRE=3599;;;14,948964;14,949078;0,05726;;0,05726;0;-0,05726
51;14,949078;192,168,1,6;104,20,1,94;TCP;74;[TCP Dup ACK 33#6] 58001  >  443 [ACK] Seq=1676 Ack=213 Win=131328 Len=0 SLE=9163 SRE=11950 SLE=725 SRE=3599;;;14,949078;15,006338;0;;0;0;0
52;15,006338;104,20,1,94;192,168,1,6;TCP;1445;[TCP Retransmission] 443  >  58001 [PSH, ACK] Seq=4929 Ack=1676 Win=69632 Len=1391;;;15,006338;15,006338;0;;-0,000164;0,000164;0,000328
53;15,006338;104,20,1,94;192,168,1,6;TCP;1445;[TCP Retransmission] 443  >  58001 [PSH, ACK] Seq=6320 Ack=1676 Win=69632 Len=1391;;;15,006338;15,006338;0,000164;;-0,000037;0,000201;0,000238
54;15,006338;104,20,1,94;192,168,1,6;TCP;1506;[TCP Retransmission] 443  >  58001 [ACK] Seq=7711 Ack=1676 Win=69632 Len=1452;;;15,006338;15,006502;0,000201;;-0,029267;0,029468;0,058735
55;15,006502;192,168,1,6;104,20,1,94;TCP;82;[TCP Dup ACK 33#7] 58001  >  443 [ACK] Seq=1676 Ack=213 Win=131328 Len=0 SLE=4929 SRE=7711 SLE=9163 SRE=11950 SLE=725 SRE=3599;;;15,006502;15,006703;0,029468;;-0,002029;0,031497;0,033526
56;15,006703;192,168,1,6;104,20,1,94;TCP;74;[TCP Dup ACK 33#8] 58001  >  443 [ACK] Seq=1676 Ack=213 Win=131328 Len=0 SLE=4929 SRE=11950 SLE=725 SRE=3599;;;15,006703;15,036171;0,031497;;0,031343;0,000154;-0,031189
57;15,036171;192,168,1,6;36,92,238,205;TCP;66;[TCP Retransmission] 57999  >  80 [SYN] Seq=0 Win=64240 Len=0 MSS=1460 WS=256 SACK_PERM=1;;;15,036171;15,067668;0,000154;;-0,090052;0,090206;0,180258
58;15,067668;104,20,1,94;192,168,1,6;TCP;1384;[TCP Retransmission] 443  >  58001 [PSH, ACK] Seq=3599 Ack=1676 Win=69632 Len=1330;;;15,067668;15,067822;0,090206;;0,071394;0,018812;-0,052582
59;15,067822;192,168,1,6;104,20,1,94;TCP;66;[TCP Dup ACK 33#9] 58001  >  443 [ACK] Seq=1676 Ack=213 Win=131328 Len=0 SLE=725 SRE=11950;;;15,067822;15,158028;0,018812;;-0,715204;0,734016;1,44922
60;15,158028;192,168,1,6;104,20,1,94;TCP;66;[TCP Retransmission] 58000  >  443 [SYN] Seq=0 Win=64240 Len=0 MSS=1460 WS=256 SACK_PERM=1;;;15,158028;15,17684;0,734016;;0,733768;0,000248;-0,73352
61;15,17684;125,162,96,1;192,168,1,6;ICMP;94;Destination unreachable (Communication administratively filtered);;;15,17684;15,910856;0,000248;;-0,009707;0,009955;0,019662
62;15,910856;104,20,1,94;192,168,1,6;TCP;566;[TCP Retransmission] 443  >  58001 [PSH, ACK] Seq=213 Ack=1676 Win=69632 Len=512;;;15,910856;15,911104;0,009955;;-0,043794;0,053749;0,097543
63;15,911104;192,168,1,6;104,20,1,94;TCP;54;58001  >  443 [ACK] Seq=1676 Ack=11950 Win=131584 Len=0;;;15,911104;15,921059;0,053749;;-0,56106;0,614809;1,175869
64;15,921059;192,168,1,6;104,20,1,94;TLSv1,3;85;Application Data;;;15,921059;15,974808;0,614809;;0,59097;0,023839;-0,567131
65;15,974808;104,20,1,94;192,168,1,6;TCP;56;443  >  58001 [ACK] Seq=11950 Ack=1707 Win=69632 Len=0;;;15,974808;16,589617;0,023839;;-0,14278;0,166619;0,309399
112;16,589617;192,168,1,6;172.217.194.188;TCP;55;57977  >  5228 [ACK] Seq=1 Ack=1 Win=512 Len=1;;;16,589617;16,613456;0,166619;;0,166499;0,00012;-0,166379
115;16,613456;172.217.194.188;192,168,1,6;TCP;66;5228  >  57977 [ACK] Seq=1 Ack=2 Win=265 Len=0 SLE=1 SRE=2;;;16,613456;16,780075;0,00012;;-0,261105;0,261225;0,52233
127;16,780075;117,18,237,29;192,168,1,6;TCP;56;80  >  57945 [ACK] Seq=1 Ack=1 Win=290 Len=0;;;16,780075;16,780195;0,261225;;0,235507;0,025718;-0,209789
128;16,780195;192,168,1,6;117,18,237,29;TCP;54;[TCP ACKed unseen segment] 57945  >  80 [ACK] Seq=1 Ack=2 Win=516 Len=0;;;16,780195;17,04142;0,025718;;0,02556;0,000158;-0,025402
156;17,04142;192,168,1,6;18.139.205.223;TCP;66;58002  >  443 [SYN] Seq=0 Win=64240 Len=0 MSS=1460 WS=256 SACK_PERM=1;;;17,04142;17,067138;0,000158;;-0,001319;0,001477;0,002796
164;17,067138;18.139.205.223;192,168,1,6;TCP;66;443  >  58002 [SYN, ACK] Seq=0 Ack=1 Win=26883 Len=0 MSS=1452 SACK_PERM=1 WS=256;;;17,067138;17,067296;0,001477;;-0,026202;0,027679;0,053881
165;17,067296;192,168,1,6;18.139.205.223;TCP;54;58002  >  443 [ACK] Seq=1 Ack=1 Win=132096 Len=0;;;17,067296;17,068773;0,027679;;0,024657;0,003022;-0,021635
167;17,068773;192,168,1,6;18.139.205.223;TLSv1,2;571;Client Hello;;;17,068773;17,096452;0,003022;;0,003022;0;-0,003022
180;17,096452;18.139.205.223;192,168,1,6;TCP;54;443  >  58002 [ACK] Seq=1 Ack=518 Win=28160 Len=0;;;17,096452;17,099474;0;;0;0;0
181;17,099474;18.139.205.223;192,168,1,6;TLSv1,2;1506;Server Hello;;;17,099474;17,099474;0;;0;0;0
182;17,099474;18.139.205.223;192,168,1,6;TCP;1506;443  >  58002 [ACK] Seq=1453 Ack=518 Win=28160 Len=1452 [TCP segment of a reassembled PDU];;;17,099474;17,099474;0;;-0,000336;0,000336;0,000672
183;17,099474;18.139.205.223;192,168,1,6;TCP;1506;443  >  58002 [ACK] Seq=2905 Ack=518 Win=28160 Len=1452 [TCP segment of a reassembled PDU];;;17,099474;17,099474;0,000336;;-0,042084;0,04242;0,084504
184;17,099474;18.139.205.223;192,168,1,6;TLSv1,2;1192;Certificate, Server Key Exchange, Server Hello Done;;;17,099474;17,09981;0,04242;;0,042038;0,000382;-0,041656
185;17,09981;192,168,1,6;18.139.205.223;TCP;54;58002  >  443 [ACK] Seq=518 Ack=5495 Win=132096 Len=0;;;17,09981;17,14223;0,000382;;-0,000159;0,000541;0,0007
190;17,14223;192,168,1,6;18.139.205.223;TLSv1,2;180;Client Key Exchange, Change Cipher Spec, Encrypted Handshake Message;;;17,14223;17,142612;0,000541;;0,000541;0;-0,000541
191;17,142612;192,168,1,6;18.139.205.223;TLSv1,2;153;Application Data;;;17,142612;17,143153;0;;0;0;0
192;17,143153;192,168,1,6;18.139.205.223;TCP;1506;58002  >  443 [ACK] Seq=743 Ack=5495 Win=132096 Len=1452 [TCP segment of a reassembled PDU];;;17,143153;17,143153;0;;-0,017628;0,017628;0,035256
193;17,143153;192,168,1,6;18.139.205.223;TCP;1506;58002  >  443 [ACK] Seq=2195 Ack=5495 Win=132096 Len=1452 [TCP segment of a reassembled PDU];;;17,143153;17,143153;0,017628;;0,009696;0,007932;-0,001764
194;17,143153;192,168,1,6;18.139.205.223;TLSv1,2;191;Application Data;;;17,143153;17,160781;0,007932;;0,007932;0;-0,007932
198;17,160781;192,168,1,6;104,20,1,94;TCP;66;[TCP Retransmission] 58000  >  443 [SYN] Seq=0 Win=64240 Len=0 MSS=1460 WS=256 SACK_PERM=1;;;17,160781;17,168713;0;;-0,000123;0,000123;0,000246
199;17,168713;18.139.205.223;192,168,1,6;TLSv1,2;328;New Session Ticket, Change Cipher Spec, Encrypted Handshake Message;;;17,168713;17,168713;0,000123;;-0,000306;0,000429;0,000735
200;17,168713;18.139.205.223;192,168,1,6;TLSv1,2;123;Application Data;;;17,168713;17,168836;0,000429;;-0,001052;0,001481;0,002533
201;17,168836;192,168,1,6;18.139.205.223;TCP;54;58002  >  443 [ACK] Seq=3784 Ack=5838 Win=131584 Len=0;;;17,168836;17,169265;0,001481;;-0,001917;0,003398;0,005315
202;17,169265;192,168,1,6;18.139.205.223;TLSv1,2;92;Application Data;;;17,169265;17,170746;0,003398;;-0,003684;0,007082;0,010766
203;17,170746;18.139.205.223;192,168,1,6;TLSv1,2;92;Application Data;;;17,170746;17,174144;0,007082;;0,000437;0,006645;0,006208
204;17,174144;125,162,96,1;192,168,1,6;ICMP;94;Destination unreachable (Communication administratively filtered);;;17,174144;17,181226;0,006645;;0,006645;0;-0,006645
207;17,181226;18.139.205.223;192,168,1,6;TCP;56;443  >  58002 [ACK] Seq=5876 Ack=3647 Win=33792 Len=0;;;17,181226;17,187871;0;;-0,000103;0,000103;0,000206
208;17,187871;18.139.205.223;192,168,1,6;TCP;1506;443  >  58002 [ACK] Seq=5876 Ack=3784 Win=36864 Len=1452 [TCP segment of a reassembled PDU];;;17,187871;17,187871;0,000103;;-0,001151;0,001254;0,002405
209;17,187871;18.139.205.223;192,168,1,6;TCP;1506;443  >  58002 [ACK] Seq=7328 Ack=3784 Win=36864 Len=1452 [TCP segment of a reassembled PDU];;;17,187871;17,187974;0,001254;;0,001204;0,00005;-0,001154
210;17,187974;192,168,1,6;18.139.205.223;TCP;54;58002  >  443 [ACK] Seq=3822 Ack=8780 Win=132096 Len=0;;;17,187974;17,189228;0,00005;;-0,001842;0,001892;0,003734
211;17,189228;18.139.205.223;192,168,1,6;TCP;1506;443  >  58002 [ACK] Seq=8780 Ack=3784 Win=36864 Len=1452 [TCP segment of a reassembled PDU];;;17,189228;17,189278;0,001892;;0,001892;0;-0,001892
212;17,189278;192,168,1,6;18.139.205.223;TCP;54;58002  >  443 [ACK] Seq=3822 Ack=10232 Win=132096 Len=0;;;17,189278;17,19117;0;;-0,000039;0,000039;0,000078
213;17,19117;18.139.205.223;192,168,1,6;TCP;1506;443  >  58002 [ACK] Seq=10232 Ack=3784 Win=36864 Len=1452 [TCP segment of a reassembled PDU];;;17,19117;17,19117;0,000039;;-0,000993;0,001032;0,002025
214;17,19117;18.139.205.223;192,168,1,6;TCP;1506;443  >  58002 [ACK] Seq=11684 Ack=3784 Win=36864 Len=1452 [TCP segment of a reassembled PDU];;;17,19117;17,191209;0,001032;;0,000979;0,000053;-0,000926
215;17,191209;192,168,1,6;18.139.205.223;TCP;54;58002  >  443 [ACK] Seq=3822 Ack=13136 Win=132096 Len=0;;;17,191209;17,192241;0,000053;;-0,002036;0,002089;0,004125
216;17,192241;18.139.205.223;192,168,1,6;TCP;1506;443  >  58002 [ACK] Seq=13136 Ack=3784 Win=36864 Len=1452 [TCP segment of a reassembled PDU];;;17,192241;17,192294;0,002089;;0,002089;0;-0,002089
217;17,192294;192,168,1,6;18.139.205.223;TCP;54;58002  >  443 [ACK] Seq=3822 Ack=14588 Win=132096 Len=0;;;17,192294;17,194383;0;;-0,000052;0,000052;0,000104
218;17,194383;18.139.205.223;192,168,1,6;TLSv1,2;1506;Application Data [TCP segment of a reassembled PDU];;;17,194383;17,194383;0,000052;;-0,001212;0,001264;0,002476
219;17,194383;18.139.205.223;192,168,1,6;TCP;1506;443  >  58002 [ACK] Seq=16040 Ack=3784 Win=36864 Len=1452 [TCP segment of a reassembled PDU];;;17,194383;17,194435;0,001264;;0,001208;0,000056;-0,001152
220;17,194435;192,168,1,6;18.139.205.223;TCP;54;58002  >  443 [ACK] Seq=3822 Ack=17492 Win=132096 Len=0;;;17,194435;17,195699;0,000056;;-0,002996;0,003052;0,006048
221;17,195699;18.139.205.223;192,168,1,6;TCP;1506;443  >  58002 [ACK] Seq=17492 Ack=3784 Win=36864 Len=1452 [TCP segment of a reassembled PDU];;;17,195699;17,195755;0,003052;;0,003052;0;-0,003052
222;17,195755;192,168,1,6;18.139.205.223;TCP;54;58002  >  443 [ACK] Seq=3822 Ack=18944 Win=132096 Len=0;;;17,195755;17,198807;0;;-0,000069;0,000069;0,000138
223;17,198807;18.139.205.223;192,168,1,6;TCP;1506;443  >  58002 [ACK] Seq=18944 Ack=3784 Win=36864 Len=1452 [TCP segment of a reassembled PDU];;;17,198807;17,198807;0,000069;;-0,019487;0,019556;0,039043
224;17,198807;18.139.205.223;192,168,1,6;TCP;1506;443  >  58002 [ACK] Seq=20396 Ack=3784 Win=36864 Len=1452 [TCP segment of a reassembled PDU];;;17,198807;17,198876;0,019556;;0,019556;0;-0,019556
225;17,198876;192,168,1,6;18.139.205.223;TCP;54;58002  >  443 [ACK] Seq=3822 Ack=21848 Win=132096 Len=0;;;17,198876;17,218432;0;;0;0;0
227;17,218432;18.139.205.223;192,168,1,6;TCP;1506;443  >  58002 [ACK] Seq=21848 Ack=3822 Win=36864 Len=1452 [TCP segment of a reassembled PDU];;;17,218432;17,218432;0;;0;0;0
228;17,218432;18.139.205.223;192,168,1,6;TCP;1506;443  >  58002 [ACK] Seq=23300 Ack=3822 Win=36864 Len=1452 [TCP segment of a reassembled PDU];;;17,218432;17,218432;0;;0;0;0
229;17,218432;18.139.205.223;192,168,1,6;TCP;1506;443  >  58002 [ACK] Seq=24752 Ack=3822 Win=36864 Len=1452 [TCP segment of a reassembled PDU];;;17,218432;17,218432;0;;0;0;0
230;17,218432;18.139.205.223;192,168,1,6;TCP;1506;443  >  58002 [ACK] Seq=26204 Ack=3822 Win=36864 Len=1452 [TCP segment of a reassembled PDU];;;17,218432;17,218432;0;;0;0;0
231;17,218432;18.139.205.223;192,168,1,6;TCP;1506;443  >  58002 [ACK] Seq=27656 Ack=3822 Win=36864 Len=1452 [TCP segment of a reassembled PDU];;;17,218432;17,218432;0;;0;0;0
232;17,218432;18.139.205.223;192,168,1,6;TCP;1506;443  >  58002 [ACK] Seq=29108 Ack=3822 Win=36864 Len=1452 [TCP segment of a reassembled PDU];;;17,218432;17,218432;0;;0;0;0
233;17,218432;18.139.205.223;192,168,1,6;TLSv1,2;1506;Application Data [TCP segment of a reassembled PDU];;;17,218432;17,218432;0;;0;0;0
234;17,218432;18.139.205.223;192,168,1,6;TCP;1506;443  >  58002 [ACK] Seq=32012 Ack=3822 Win=36864 Len=1452 [TCP segment of a reassembled PDU];;;17,218432;17,218432;0;;0;0;0
235;17,218432;18.139.205.223;192,168,1,6;TCP;1506;443  >  58002 [ACK] Seq=33464 Ack=3822 Win=36864 Len=1452 [TCP segment of a reassembled PDU];;;17,218432;17,218432;0;;0;0;0
236;17,218432;18.139.205.223;192,168,1,6;TCP;1506;443  >  58002 [ACK] Seq=34916 Ack=3822 Win=36864 Len=1452 [TCP segment of a reassembled PDU];;;17,218432;17,218432;0;;-0,00013;0,00013;0,00026
237;17,218432;18.139.205.223;192,168,1,6;TCP;1506;443  >  58002 [ACK] Seq=36368 Ack=3822 Win=36864 Len=1452 [TCP segment of a reassembled PDU];;;17,218432;17,218432;0,00013;;-0,00412;0,00425;0,00837
238;17,218432;18.139.205.223;192,168,1,6;TCP;1506;443  >  58002 [ACK] Seq=37820 Ack=3822 Win=36864 Len=1452 [TCP segment of a reassembled PDU];;;17,218432;17,218562;0,00425;;0,00425;0;-0,00425
239;17,218562;192,168,1,6;18.139.205.223;TCP;54;58002  >  443 [ACK] Seq=3822 Ack=39272 Win=132096 Len=0;;;17,218562;17,222812;0;;0;0;0
240;17,222812;18.139.205.223;192,168,1,6;TCP;1506;443  >  58002 [ACK] Seq=39272 Ack=3822 Win=36864 Len=1452 [TCP segment of a reassembled PDU];;;17,222812;17,222812;0;;0;0;0
241;17,222812;18.139.205.223;192,168,1,6;TCP;1506;443  >  58002 [ACK] Seq=40724 Ack=3822 Win=36864 Len=1452 [TCP segment of a reassembled PDU];;;17,222812;17,222812;0;;0;0;0
242;17,222812;18.139.205.223;192,168,1,6;TCP;1506;443  >  58002 [ACK] Seq=42176 Ack=3822 Win=36864 Len=1452 [TCP segment of a reassembled PDU];;;17,222812;17,222812;0;;-0,000097;0,000097;0,000194
243;17,222812;18.139.205.223;192,168,1,6;TCP;1506;443  >  58002 [ACK] Seq=43628 Ack=3822 Win=36864 Len=1452 [TCP segment of a reassembled PDU];;;17,222812;17,222812;0,000097;;-0,001729;0,001826;0,003555
244;17,222812;18.139.205.223;192,168,1,6;TCP;1506;443  >  58002 [ACK] Seq=45080 Ack=3822 Win=36864 Len=1452 [TCP segment of a reassembled PDU];;;17,222812;17,222909;0,001826;;0,001826;0;-0,001826
245;17,222909;192,168,1,6;18.139.205.223;TCP;54;58002  >  443 [ACK] Seq=3822 Ack=46532 Win=132096 Len=0;;;17,222909;17,224735;0;;-0,00006;0,00006;0,00012
246;17,224735;18.139.205.223;192,168,1,6;TLSv1,2;1506;Application Data, Application Data;;;17,224735;17,224735;0,00006;;-0,001285;0,001345;0,00263
247;17,224735;18.139.205.223;192,168,1,6;TCP;1506;443  >  58002 [ACK] Seq=47984 Ack=3822 Win=36864 Len=1452 [TCP segment of a reassembled PDU];;;17,224735;17,224795;0,001345;;0,001281;0,000064;-0,001217
248;17,224795;192,168,1,6;18.139.205.223;TCP;54;58002  >  443 [ACK] Seq=3822 Ack=49436 Win=132096 Len=0;;;17,224795;17,22614;0,000064;;-0,001417;0,001481;0,002898
249;17,22614;18.139.205.223;192,168,1,6;TCP;1506;443  >  58002 [ACK] Seq=49436 Ack=3822 Win=36864 Len=1452 [TCP segment of a reassembled PDU];;;17,22614;17,226204;0,001481;;-0,000932;0,002413;0,003345
250;17,226204;192,168,1,6;18.139.205.223;TCP;54;58002  >  443 [ACK] Seq=3822 Ack=50888 Win=132096 Len=0;;;17,226204;17,227685;0,002413;;0,002413;0;-0,002413
251;17,227685;18.139.205.223;192,168,1,6;TCP;1506;443  >  58002 [ACK] Seq=50888 Ack=3822 Win=36864 Len=1452 [TCP segment of a reassembled PDU];;;17,227685;17,230098;0;;0;0;0
252;17,230098;18.139.205.223;192,168,1,6;TCP;1506;443  >  58002 [ACK] Seq=52340 Ack=3822 Win=36864 Len=1452 [TCP segment of a reassembled PDU];;;17,230098;17,230098;0;;-0,000072;0,000072;0,000144
253;17,230098;18.139.205.223;192,168,1,6;TCP;1506;443  >  58002 [ACK] Seq=53792 Ack=3822 Win=36864 Len=1452 [TCP segment of a reassembled PDU];;;17,230098;17,230098;0,000072;;-0,023468;0,02354;0,047008
254;17,230098;18.139.205.223;192,168,1,6;TCP;1506;443  >  58002 [ACK] Seq=55244 Ack=3822 Win=36864 Len=1452 [TCP segment of a reassembled PDU];;;17,230098;17,23017;0,02354;;0,02354;0;-0,02354
255;17,23017;192,168,1,6;18.139.205.223;TCP;54;58002  >  443 [ACK] Seq=3822 Ack=56696 Win=132096 Len=0;;;17,23017;17,25371;0;;0;0;0
256;17,25371;18.139.205.223;192,168,1,6;TCP;1506;443  >  58002 [ACK] Seq=56696 Ack=3822 Win=36864 Len=1452 [TCP segment of a reassembled PDU];;;17,25371;17,25371;0;;0;0;0
257;17,25371;18.139.205.223;192,168,1,6;TCP;1506;443  >  58002 [ACK] Seq=58148 Ack=3822 Win=36864 Len=1452 [TCP segment of a reassembled PDU];;;17,25371;17,25371;0;;0;0;0
258;17,25371;18.139.205.223;192,168,1,6;TLSv1,2;1506;Application Data [TCP segment of a reassembled PDU];;;17,25371;17,25371;0;;0;0;0
259;17,25371;18.139.205.223;192,168,1,6;TCP;1506;443  >  58002 [ACK] Seq=61052 Ack=3822 Win=36864 Len=1452 [TCP segment of a reassembled PDU];;;17,25371;17,25371;0;;0;0;0
260;17,25371;18.139.205.223;192,168,1,6;TCP;1506;443  >  58002 [ACK] Seq=62504 Ack=3822 Win=36864 Len=1452 [TCP segment of a reassembled PDU];;;17,25371;17,25371;0;;0;0;0
261;17,25371;18.139.205.223;192,168,1,6;TCP;1506;443  >  58002 [ACK] Seq=63956 Ack=3822 Win=36864 Len=1452 [TCP segment of a reassembled PDU];;;17,25371;17,25371;0;;0;0;0
262;17,25371;18.139.205.223;192,168,1,6;TCP;1506;443  >  58002 [ACK] Seq=65408 Ack=3822 Win=36864 Len=1452 [TCP segment of a reassembled PDU];;;17,25371;17,25371;0;;0;0;0
263;17,25371;18.139.205.223;192,168,1,6;TCP;1506;443  >  58002 [ACK] Seq=66860 Ack=3822 Win=36864 Len=1452 [TCP segment of a reassembled PDU];;;17,25371;17,25371;0;;0;0;0
264;17,25371;18.139.205.223;192,168,1,6;TCP;1506;443  >  58002 [ACK] Seq=68312 Ack=3822 Win=36864 Len=1452 [TCP segment of a reassembled PDU];;;17,25371;17,25371;0;;0;0;0
265;17,25371;18.139.205.223;192,168,1,6;TCP;1506;443  >  58002 [ACK] Seq=69764 Ack=3822 Win=36864 Len=1452 [TCP segment of a reassembled PDU];;;17,25371;17,25371;0;;0;0;0
266;17,25371;18.139.205.223;192,168,1,6;TCP;1506;443  >  58002 [ACK] Seq=71216 Ack=3822 Win=36864 Len=1452 [TCP segment of a reassembled PDU];;;17,25371;17,25371;0;;0;0;0
267;17,25371;18.139.205.223;192,168,1,6;TCP;1506;443  >  58002 [ACK] Seq=72668 Ack=3822 Win=36864 Len=1452 [TCP segment of a reassembled PDU];;;17,25371;17,25371;0;;-0,000177;0,000177;0,000354
268;17,25371;18.139.205.223;192,168,1,6;TCP;1506;443  >  58002 [ACK] Seq=74120 Ack=3822 Win=36864 Len=1452 [TCP segment of a reassembled PDU];;;17,25371;17,25371;0,000177;;-0,00032;0,000497;0,000817
269;17,25371;18.139.205.223;192,168,1,6;TLSv1,2;1506;Application Data [TCP segment of a reassembled PDU];;;17,25371;17,253887;0,000497;;0,000497;0;-0,000497
270;17,253887;192,168,1,6;18.139.205.223;TCP;54;58002  >  443 [ACK] Seq=3822 Ack=77024 Win=132096 Len=0;;;17,253887;17,254384;0;;0;0;0
271;17,254384;18.139.205.223;192,168,1,6;TCP;1506;443  >  58002 [ACK] Seq=77024 Ack=3822 Win=36864 Len=1452 [TCP segment of a reassembled PDU];;;17,254384;17,254384;0;;0;0;0
272;17,254384;18.139.205.223;192,168,1,6;TCP;1506;443  >  58002 [ACK] Seq=78476 Ack=3822 Win=36864 Len=1452 [TCP segment of a reassembled PDU];;;17,254384;17,254384;0;;-0,000104;0,000104;0,000208
273;17,254384;18.139.205.223;192,168,1,6;TCP;1506;443  >  58002 [ACK] Seq=79928 Ack=3822 Win=36864 Len=1452 [TCP segment of a reassembled PDU];;;17,254384;17,254384;0,000104;;-0,174977;0,175081;0,350058
274;17,254384;18.139.205.223;192,168,1,6;TLSv1,2;1180;Application Data, Application Data;;;17,254384;17,254488;0,175081;;0,175081;0;-0,175081
275;17,254488;192,168,1,6;18.139.205.223;TCP;54;58002  >  443 [ACK] Seq=3822 Ack=82506 Win=132096 Len=0;;;17,254488;17,429569;0;;0;0;0
277;17,429569;192,168,1,6;18.139.205.223;TCP;1506;58002  >  443 [ACK] Seq=3822 Ack=82506 Win=132096 Len=1452 [TCP segment of a reassembled PDU];;;17,429569;17,429569;0;;0;0;0
278;17,429569;192,168,1,6;18.139.205.223;TCP;1506;58002  >  443 [ACK] Seq=5274 Ack=82506 Win=132096 Len=1452 [TCP segment of a reassembled PDU];;;17,429569;17,429569;0;;-0,008431;0,008431;0,016862
279;17,429569;192,168,1,6;18.139.205.223;TCP;1506;58002  >  443 [ACK] Seq=6726 Ack=82506 Win=132096 Len=1452 [TCP segment of a reassembled PDU];;;17,429569;17,429569;0,008431;;-0,001548;0,009979;0,011527
280;17,429569;192,168,1,6;18.139.205.223;TLSv1,2;172;Application Data;;;17,429569;17,438;0,009979;;0,009925;0,000054;-0,009871
282;17,438;192,168,1,6;18.139.205.223;TLSv1,2;257;Application Data;;;17,438;17,447979;0,000054;;-0,008977;0,009031;0,018008
284;17,447979;117,18,237,29;192,168,1,6;TCP;56;80  >  57958 [ACK] Seq=1 Ack=1 Win=288 Len=0;;;17,447979;17,448033;0,009031;;0,000834;0,008197;0,007363
285;17,448033;192,168,1,6;117,18,237,29;TCP;54;[TCP ACKed unseen segment] 57958  >  80 [ACK] Seq=1 Ack=2 Win=513 Len=0;;;17,448033;17,457064;0,008197;;0,004346;0,003851;-0,000495
287;17,457064;192,168,1,6;13,35,99,88;TCP;66;58003  >  443 [SYN] Seq=0 Win=64240 Len=0 MSS=1460 WS=256 SACK_PERM=1;;;17,457064;17,465261;0,003851;;0,001998;0,001853;-0,000145
289;17,465261;18.139.205.223;192,168,1,6;TCP;56;443  >  58002 [ACK] Seq=82506 Ack=6726 Win=42496 Len=0;;;17,465261;17,469112;0,001853;;-0,005576;0,007429;0,013005
291;17,469112;192,168,1,6;104,244,38,20;TCP;66;58004  >  443 [SYN] Seq=0 Win=64240 Len=0 MSS=1460 WS=256 SACK_PERM=1;;;17,469112;17,470965;0,007429;;0,007429;0;-0,007429
292;17,470965;18.139.205.223;192,168,1,6;TCP;56;443  >  58002 [ACK] Seq=82506 Ack=8296 Win=45568 Len=0;;;17,470965;17,478394;0;;-0,000082;0,000082;0,000164
293;17,478394;18.139.205.223;192,168,1,6;TLSv1,2;430;Application Data;;;17,478394;17,478394;0,000082;;-0,007372;0,007454;0,014826
294;17,478394;18.139.205.223;192,168,1,6;TLSv1,2;92;Application Data;;;17,478394;17,478476;0,007454;;0,006937;0,000517;-0,00642
295;17,478476;192,168,1,6;18.139.205.223;TCP;54;58002  >  443 [ACK] Seq=8499 Ack=82920 Win=131584 Len=0;;;17,478476;17,48593;0,000517;;0,000517;0;-0,000517
296;17,48593;18.139.205.223;192,168,1,6;TCP;1506;443  >  58002 [ACK] Seq=82920 Ack=8499 Win=48384 Len=1452 [TCP segment of a reassembled PDU];;;17,48593;17,486447;0;;-0,000075;0,000075;0,00015
297;17,486447;18.139.205.223;192,168,1,6;TCP;1506;443  >  58002 [ACK] Seq=84372 Ack=8499 Win=48384 Len=1452 [TCP segment of a reassembled PDU];;;17,486447;17,486447;0,000075;;-0,014552;0,014627;0,029179
298;17,486447;18.139.205.223;192,168,1,6;TLSv1,2;102;Application Data;;;17,486447;17,486522;0,014627;;0,01365;0,000977;-0,012673
299;17,486522;192,168,1,6;18.139.205.223;TCP;54;58002  >  443 [ACK] Seq=8499 Ack=85872 Win=132096 Len=0;;;17,486522;17,501149;0,000977;;-0,029915;0,030892;0,060807
300;17,501149;192,168,1,6;104,244,38,20;TCP;66;58005  >  443 [SYN] Seq=0 Win=64240 Len=0 MSS=1460 WS=256 SACK_PERM=1;;;17,501149;17,502126;0,030892;;0,012323;0,018569;0,006246
301;17,502126;192,168,1,6;104,244,38,20;TCP;66;58006  >  443 [SYN] Seq=0 Win=64240 Len=0 MSS=1460 WS=256 SACK_PERM=1;;;17,502126;17,533018;0,018569;;0,01845;0,000119;-0,018331
304;17,533018;192,168,1,6;74.125.200.154;TCP;66;58007  >  443 [SYN] Seq=0 Win=64240 Len=0 MSS=1460 WS=256 SACK_PERM=1;;;17,533018;17,551587;0,000119;;-0,000383;0,000502;0,000885
305;17,551587;74.125.200.154;192,168,1,6;TCP;66;443  >  58007 [SYN, ACK] Seq=0 Ack=1 Win=65535 Len=0 MSS=1430 SACK_PERM=1 WS=256;;;17,551587;17,551706;0,000502;;-0,021359;0,021861;0,04322
306;17,551706;192,168,1,6;74.125.200.154;TCP;54;58007  >  443 [ACK] Seq=1 Ack=1 Win=131328 Len=0;;;17,551706;17,552208;0,021861;;0,021175;0,000686;-0,020489
307;17,552208;192,168,1,6;74.125.200.154;TLSv1,3;571;Client Hello;;;17,552208;17,574069;0,000686;;0,000686;0;-0,000686
308;17,574069;74.125.200.154;192,168,1,6;TCP;54;443  >  58007 [ACK] Seq=1 Ack=518 Win=66816 Len=0;;;17,574069;17,574755;0;;-0,000078;0,000078;0,000156
309;17,574755;74.125.200.154;192,168,1,6;TLSv1,3;1484;Server Hello, Change Cipher Spec;;;17,574755;17,574755;0,000078;;-0,000066;0,000144;0,00021
310;17,574755;74.125.200.154;192,168,1,6;TCP;1484;443  >  58007 [ACK] Seq=1431 Ack=518 Win=66816 Len=1430 [TCP segment of a reassembled PDU];;;17,574755;17,574833;0,000144;;-0,01519;0,015334;0,030524
311;17,574833;192,168,1,6;74.125.200.154;TCP;54;58007  >  443 [ACK] Seq=518 Ack=2861 Win=131328 Len=0;;;17,574833;17,574977;0,015334;;0,01416;0,001174;-0,012986
312;17,574977;74.125.200.154;192,168,1,6;TLSv1,3;74;Application Data;;;17,574977;17,590311;0,001174;;0,000812;0,000362;-0,00045
313;17,590311;192,168,1,6;74.125.200.154;TLSv1,3;118;Change Cipher Spec, Application Data;;;17,590311;17,591485;0,000362;;-0,000451;0,000813;0,001264
314;17,591485;192,168,1,6;104,244,38,20;TCP;66;58008  >  443 [SYN] Seq=0 Win=64240 Len=0 MSS=1460 WS=256 SACK_PERM=1;;;17,591485;17,591847;0,000813;;0,000813;0;-0,000813
315;17,591847;192,168,1,6;74.125.200.154;TLSv1,3;146;Application Data;;;17,591847;17,59266;0;;0;0;0
316;17,59266;192,168,1,6;74.125.200.154;TCP;1484;58007  >  443 [ACK] Seq=674 Ack=2881 Win=131328 Len=1430 [TCP segment of a reassembled PDU];;;17,59266;17,59266;0;;-0,015435;0,015435;0,03087
317;17,59266;192,168,1,6;74.125.200.154;TCP;1484;58007  >  443 [ACK] Seq=2104 Ack=2881 Win=131328 Len=1430 [TCP segment of a reassembled PDU];;;17,59266;17,59266;0,015435;;0,014982;0,000453;-0,014529
318;17,59266;192,168,1,6;74.125.200.154;TLSv1,3;369;Application Data;;;17,59266;17,608095;0,000453;;0,000319;0,000134;-0,000185
319;17,608095;74.125.200.154;192,168,1,6;TLSv1,3;634;Application Data, Application Data;;;17,608095;17,608548;0,000134;;-0,010755;0,010889;0,021644
320;17,608548;192,168,1,6;74.125.200.154;TLSv1,3;85;Application Data;;;17,608548;17,608682;0,010889;;0,004619;0,00627;0,001651
321;17,608682;74.125.200.154;192,168,1,6;TLSv1,3;85;Application Data;;;17,608682;17,619571;0,00627;;-0,014035;0,020305;0,03434
322;17,619571;74.125.200.154;192,168,1,6;TCP;56;443  >  58007 [ACK] Seq=3492 Ack=3534 Win=72448 Len=0;;;17,619571;17,625841;0,020305;;0,020089;0,000216;-0,019873
323;17,625841;74.125.200.154;192,168,1,6;TCP;56;443  >  58007 [ACK] Seq=3492 Ack=3880 Win=75264 Len=0;;;17,625841;17,646146;0,000216;;-0,00062;0,000836;0,001456
324;17,646146;13,35,99,88;192,168,1,6;TCP;66;443  >  58003 [SYN, ACK] Seq=0 Ack=1 Win=29200 Len=0 MSS=1452 SACK_PERM=1 WS=256;;;17,646146;17,646362;0,000836;;-0,003267;0,004103;0,00737
325;17,646362;192,168,1,6;13,35,99,88;TCP;54;58003  >  443 [ACK] Seq=1 Ack=1 Win=132096 Len=0;;;17,646362;17,647198;0,004103;;0,003104;0,000999;-0,002105
326;17,647198;192,168,1,6;13,35,99,88;TLSv1,3;571;Client Hello;;;17,647198;17,651301;0,000999;;-0,000252;0,001251;0,001503
327;17,651301;192,168,1,6;74.125.200.154;TCP;54;58007  >  443 [ACK] Seq=3880 Ack=3492 Win=130816 Len=0;;;17,651301;17,6523;0,001251;;0,001251;0;-0,001251
328;17,6523;74.125.200.154;192,168,1,6;TLSv1,3;604;Application Data;;;17,6523;17,653551;0;;0;0;0
329;17,653551;74.125.200.154;192,168,1,6;TLSv1,3;1484;Application Data;;;17,653551;17,653551;0;;0;0;0
330;17,653551;74.125.200.154;192,168,1,6;TLSv1,3;1484;Application Data;;;17,653551;17,653551;0;;-0,000241;0,000241;0,000482
331;17,653551;74.125.200.154;192,168,1,6;TLSv1,3;1484;Application Data;;;17,653551;17,653551;0,000241;;-0,000156;0,000397;0,000553
332;17,653551;74.125.200.154;192,168,1,6;TLSv1,3;1484;Application Data;;;17,653551;17,653792;0,000397;;0,000397;0;-0,000397
333;17,653792;192,168,1,6;74.125.200.154;TCP;54;58007  >  443 [ACK] Seq=3880 Ack=9762 Win=131328 Len=0;;;17,653792;17,654189;0;;-0,000128;0,000128;0,000256
334;17,654189;74.125.200.154;192,168,1,6;TLSv1,3;1484;Application Data;;;17,654189;17,654189;0,000128;;-0,000806;0,000934;0,00174
335;17,654189;74.125.200.154;192,168,1,6;TLSv1,3;1484;Application Data;;;17,654189;17,654317;0,000934;;0,000934;0;-0,000934
336;17,654317;192,168,1,6;74.125.200.154;TCP;54;58007  >  443 [ACK] Seq=3880 Ack=12622 Win=131328 Len=0;;;17,654317;17,655251;0;;-0,000109;0,000109;0,000218
337;17,655251;74.125.200.154;192,168,1,6;TLSv1,3;1484;Application Data;;;17,655251;17,655251;0,000109;;-0,000078;0,000187;0,000265
338;17,655251;74.125.200.154;192,168,1,6;TLSv1,3;119;Application Data;;;17,655251;17,65536;0,000187;;0,000135;0,000052;-0,000083
339;17,65536;192,168,1,6;74.125.200.154;TCP;54;58007  >  443 [ACK] Seq=3880 Ack=14117 Win=131328 Len=0;;;17,65536;17,655547;0,000052;;-0,001758;0,00181;0,003568
340;17,655547;74.125.200.154;192,168,1,6;TLSv1,3;124;Application Data, Application Data;;;17,655547;17,655599;0,00181;;-0,020043;0,021853;0,041896
341;17,655599;192,168,1,6;74.125.200.154;TCP;54;58007  >  443 [ACK] Seq=3880 Ack=14187 Win=131328 Len=0;;;17,655599;17,657409;0,021853;;0,021625;0,000228;-0,021397
342;17,657409;192,168,1,6;74.125.200.154;TLSv1,3;93;Application Data;;;17,657409;17,679262;0,000228;;-0,000226;0,000454;0,00068
343;17,679262;104,244,38,20;192,168,1,6;TCP;66;443  >  58004 [SYN, ACK] Seq=0 Ack=1 Win=29200 Len=0 MSS=1452 SACK_PERM=1 WS=512;;;17,679262;17,67949;0,000454;;-0,002329;0,002783;0,005112
344;17,67949;192,168,1,6;104,244,38,20;TCP;54;58004  >  443 [ACK] Seq=1 Ack=1 Win=132096 Len=0;;;17,67949;17,679944;0,002783;;-0,014801;0,017584;0,032385
345;17,679944;74.125.200.154;192,168,1,6;TCP;56;443  >  58007 [ACK] Seq=14187 Ack=3919 Win=75264 Len=0;;;17,679944;17,682727;0,017584;;0,017086;0,000498;-0,016588
346;17,682727;192,168,1,6;104,244,38,20;TLSv1,2;571;Client Hello;;;17,682727;17,700311;0,000498;;0,000316;0,000182;-0,000134
350;17,700311;192,168,1,6;54.212.130.172;TCP;66;58009  >  443 [SYN] Seq=0 Win=64240 Len=0 MSS=1460 WS=256 SACK_PERM=1;;;17,700311;17,700809;0,000182;;-0,000902;0,001084;0,001986
351;17,700809;104,244,38,20;192,168,1,6;TCP;66;443  >  58005 [SYN, ACK] Seq=0 Ack=1 Win=29200 Len=0 MSS=1452 SACK_PERM=1 WS=512;;;17,700809;17,700991;0,001084;;-0,001173;0,002257;0,00343
352;17,700991;192,168,1,6;104,244,38,20;TCP;54;58005  >  443 [ACK] Seq=1 Ack=1 Win=132096 Len=0;;;17,700991;17,702075;0,002257;;0,002009;0,000248;-0,001761
353;17,702075;192,168,1,6;104,244,38,20;TLSv1,2;571;Client Hello;;;17,702075;17,704332;0,000248;;-0,000508;0,000756;0,001264
354;17,704332;104,244,38,20;192,168,1,6;TCP;66;443  >  58006 [SYN, ACK] Seq=0 Ack=1 Win=29200 Len=0 MSS=1452 SACK_PERM=1 WS=512;;;17,704332;17,70458;0,000756;;-0,084671;0,085427;0,170098
355;17,70458;192,168,1,6;104,244,38,20;TCP;54;58006  >  443 [ACK] Seq=1 Ack=1 Win=132096 Len=0;;;17,70458;17,705336;0,085427;;0,085223;0,000204;-0,085019
356;17,705336;192,168,1,6;104,244,38,20;TLSv1,2;571;Client Hello;;;17,705336;17,790763;0,000204;;-0,000757;0,000961;0,001718
361;17,790763;104,244,38,20;192,168,1,6;TCP;66;443  >  58008 [SYN, ACK] Seq=0 Ack=1 Win=29200 Len=0 MSS=1452 SACK_PERM=1 WS=512;;;17,790763;17,790967;0,000961;;-0,04626;0,047221;0,093481
362;17,790967;192,168,1,6;104,244,38,20;TCP;54;58008  >  443 [ACK] Seq=1 Ack=1 Win=132096 Len=0;;;17,790967;17,791928;0,047221;;0,047221;0;-0,047221
363;17,791928;192,168,1,6;104,244,38,20;TLSv1,2;571;Client Hello;;;17,791928;17,839149;0;;-0,001036;0,001036;0,002072
364;17,839149;13,35,99,88;192,168,1,6;TCP;54;443  >  58003 [ACK] Seq=1 Ack=518 Win=30464 Len=0;;;17,839149;17,839149;0,001036;;0,001036;0;-0,001036
365;17,839149;13,35,99,88;192,168,1,6;TLSv1,3;1506;Server Hello, Change Cipher Spec, Application Data;;;17,839149;17,840185;0;;-0,000122;0,000122;0,000244
366;17,840185;13,35,99,88;192,168,1,6;TCP;1506;443  >  58003 [ACK] Seq=1453 Ack=518 Win=30464 Len=1452 [TCP segment of a reassembled PDU];;;17,840185;17,840185;0,000122;;-0,003106;0,003228;0,006334
367;17,840185;13,35,99,88;192,168,1,6;TCP;1506;443  >  58003 [ACK] Seq=2905 Ack=518 Win=30464 Len=1452 [TCP segment of a reassembled PDU];;;17,840185;17,840307;0,003228;;0,003228;0;-0,003228
368;17,840307;192,168,1,6;13,35,99,88;TCP;54;58003  >  443 [ACK] Seq=518 Ack=4357 Win=132096 Len=0;;;17,840307;17,843535;0;;-0,000152;0,000152;0,000304
369;17,843535;13,35,99,88;192,168,1,6;TLSv1,3;1506;Application Data [TCP segment of a reassembled PDU];;;17,843535;17,843535;0,000152;;-0,050739;0,050891;0,10163
370;17,843535;13,35,99,88;192,168,1,6;TLSv1,3;156;Application Data, Application Data;;;17,843535;17,843687;0,050891;;0,050205;0,000686;-0,049519
371;17,843687;192,168,1,6;13,35,99,88;TCP;54;58003  >  443 [ACK] Seq=518 Ack=5911 Win=132096 Len=0;;;17,843687;17,894578;0,000686;;-0,000013;0,000699;0,000712
372;17,894578;192,168,1,6;13,35,99,88;TLSv1,3;118;Change Cipher Spec, Application Data;;;17,894578;17,895264;0,000699;;0,000126;0,000573;0,000447
373;17,895264;192,168,1,6;13,35,99,88;TLSv1,3;146;Application Data;;;17,895264;17,895963;0,000573;;-0,002596;0,003169;0,005765
374;17,895963;192,168,1,6;13,35,99,88;TLSv1,3;332;Application Data;;;17,895963;17,896536;0,003169;;0,003169;0;-0,003169
375;17,896536;104,244,38,20;192,168,1,6;TCP;54;443  >  58004 [ACK] Seq=1 Ack=518 Win=30720 Len=0;;;17,896536;17,899705;0;;0;0;0
376;17,899705;104,244,38,20;192,168,1,6;TLSv1,2;1506;Server Hello;;;17,899705;17,899705;0;;0;0;0
377;17,899705;104,244,38,20;192,168,1,6;TCP;1506;443  >  58004 [ACK] Seq=1453 Ack=518 Win=30720 Len=1452 [TCP segment of a reassembled PDU];;;17,899705;17,899705;0;;0;0;0
378;17,899705;104,244,38,20;192,168,1,6;TCP;1246;443  >  58004 [PSH, ACK] Seq=2905 Ack=518 Win=30720 Len=1192 [TCP segment of a reassembled PDU];;;17,899705;17,899705;0;;-0,000265;0,000265;0,00053
379;17,899705;104,244,38,20;192,168,1,6;TCP;1506;443  >  58004 [ACK] Seq=4097 Ack=518 Win=30720 Len=1452 [TCP segment of a reassembled PDU];;;17,899705;17,899705;0,000265;;-0,008922;0,009187;0,018109
380;17,899705;104,244,38,20;192,168,1,6;TLSv1,2;470;Certificate, Server Key Exchange, Server Hello Done;;;17,899705;17,89997;0,009187;;0,009187;0;-0,009187
381;17,89997;192,168,1,6;104,244,38,20;TCP;54;58004  >  443 [ACK] Seq=518 Ack=5965 Win=132096 Len=0;;;17,89997;17,909157;0;;0;0;0
382;17,909157;104,244,38,20;192,168,1,6;TCP;54;443  >  58005 [ACK] Seq=1 Ack=518 Win=30720 Len=0;;;17,909157;17,909157;0;;0;0;0
383;17,909157;104,244,38,20;192,168,1,6;TLSv1,2;1506;Server Hello;;;17,909157;17,909157;0;;0;0;0
